{
  "schema_version": "1.0",
  "task_id": "demo-review-001",
  "capability": "code-review",
  "status": "approval_required",
  "recommended_alias": "local-review",
  "registry_sha256": "0000000000000000000000000000000000000000000000000000000000000000",
  "reasons": ["manifest_only", "manual_execution_not_implemented"],
  "authority_effect": false,
  "execution_effect": false
}
